review,rating,date,bank,source,sentiment_label,sentiment_score
功能很好！Usefully!🪖🌐🔗🍚🇹🇼🇺🇸🇭🇰🇸🇬🖇️🦅🦅🦅🦅,4,2025-05-20 09:32:13,Chase,Google Play Store,POSITIVE,0.9917547702789307
"Where is my refund?! Chase representatives keep telling me different things, my refund is in an email that may or may not actually come from chase, or it's been mailed as a check that never showed up. I asked that it simply be applied to my balance but instead I am told I have to keep waiting for a check supposedly mailed more than a month ago. Chase, you're acting like a scammer. Please help!",1,2025-05-20 09:03:17,Chase,Google Play Store,NEGATIVE,0.9995927214622498
good,5,2025-05-20 08:24:55,Chase,Google Play Store,POSITIVE,0.9998161196708679
love it,5,2025-05-20 01:11:04,Chase,Google Play Store,POSITIVE,0.9998753070831299
"The hardest app I've ever used... if you need Zelle, go somewhere else. doesn't show the whole account number and if your kid lost a card and your trying to replace it, it only shows last 4 of the card number. how do I know the last 4 of a lost card??? I have 3 kids on here. I have to call my wife back home to check the other kids cards so I can do process of elimination. this is so overwhelming annoying and ridiculous. I wish I could give your app a worse rating.",1,2025-05-19 19:25:49,Chase,Google Play Store,NEGATIVE,0.9996670484542847
"terrible,they lock your account,have you update & load your phone number & Contact information,lock your account for Supposed Fake suspicious activity,an then wont unlock Said Account because they claim they are unable to verify you because the System wont allow a Call to your phone number in there system,which failed to Properly Store the Entered account Info, After giving you Electronic phone and Email Verification,On the Same Phone Number,they claim that their System doesn't recognize.",1,2025-05-19 19:00:30,Chase,Google Play Store,NEGATIVE,0.9990549683570862
"Overall good, but sometimes things are too hard to find.",3,2025-05-19 18:29:46,Chase,Google Play Store,NEGATIVE,0.9932239055633545
Love chase,5,2025-05-19 17:53:19,Chase,Google Play Store,POSITIVE,0.99983811378479
Great,5,2025-05-19 17:17:33,Chase,Google Play Store,POSITIVE,0.9998630285263062
I work overseas and every time I try to use the card it declines. so I have stopped using it for travel.,2,2025-05-19 17:02:48,Chase,Google Play Store,NEGATIVE,0.999494194984436
"really great at protecting your account, please call them or visit office RIGHT AWAY if unauthorized purchases are found.",4,2025-05-19 16:34:06,Chase,Google Play Store,POSITIVE,0.9943374991416931
employee decided to do the tip without my consent,1,2025-05-19 15:02:26,Chase,Google Play Store,NEGATIVE,0.995275616645813
could not put in username musvideos4,4,2025-05-19 12:37:44,Chase,Google Play Store,NEGATIVE,0.9975553154945374
"I love Chase online banking. it's an easy app. Everything is self-explanatory, also it is convenient",5,2025-05-19 12:32:46,Chase,Google Play Store,POSITIVE,0.9973821043968201
I locked my cards and payment still go through..they need to fix that bug,3,2025-05-19 10:56:27,Chase,Google Play Store,NEGATIVE,0.9983516931533813
so hard to navigate this app i can bever find my account and routing numbers,3,2025-05-19 10:29:17,Chase,Google Play Store,NEGATIVE,0.9993066787719727
the think I have enjoyed most is the reliability. no issues ever and it always works when I need it to.,5,2025-05-19 07:06:12,Chase,Google Play Store,POSITIVE,0.9994171857833862
"don't ever get a credit card through chase, unless you don't mind paying over three times the amount of the purchases you make due to incredibly high interest rates that they fail to inform you about on the app!! the interest rate I pay is over 35%...just find a better card because you'll never be able to pay this one off!!",2,2025-05-19 07:00:50,Chase,Google Play Store,NEGATIVE,0.9989796280860901
I cant get it in my phone dont know why,1,2025-05-19 05:33:46,Chase,Google Play Store,NEGATIVE,0.9986891150474548
"Unable to log in. It required password, text contact, biometric registration, and scanning one's driver's license, which is ridiculous since that's more than you'd need to launch a nuclear missile. It won't scan my driver's license after carefully composing the picture as requested, holding the phone as still as a sniper, and adjusting lighting for glare. I wasted nearly an hour trying to log in, then gave up. At this point I'd rather cancel my Chase account than jump through any more hoops.",1,2025-05-19 01:17:04,Chase,Google Play Store,NEGATIVE,0.999566376209259
support is always right 👍👍👍👍👍👍,5,2025-05-18 23:42:41,Chase,Google Play Store,POSITIVE,0.9998359680175781
thank you for all your help,5,2025-05-18 15:23:10,Chase,Google Play Store,POSITIVE,0.999832034111023
"Overall a fantastic app, everything is simple and convenient. Lots of info to browse, security options, and ways to setup notifications. Love it.",5,2025-05-18 14:49:17,Chase,Google Play Store,POSITIVE,0.9998703002929688
"This is from 2025, I love the app. It is clearly customer-focused and offers a stress-free and rewarding experience. I've not had to contact customer support when I need to resolve any concern. I'm so happy Chase chooses to provide a customer-first experience.",5,2025-05-18 12:26:22,Chase,Google Play Store,POSITIVE,0.9998112320899963
"The ID verification sucks, EVERY single verification app that is used will not read a barcode on a Florida license. It is very frustrating, this is a major reason why I lose access to accounts. Makes me want to close my chase account.",1,2025-05-18 10:52:39,Chase,Google Play Store,NEGATIVE,0.9997203946113586
"Easy to use. Accurate, quick & handy.",5,2025-05-18 10:50:56,Chase,Google Play Store,POSITIVE,0.9996108412742615
Check scanning no longer working correctly. Asks to scan both sides twice and gives an error message.,3,2025-05-18 10:46:19,Chase,Google Play Store,NEGATIVE,0.9997181296348572
Erroneously thinks I am not connected to a network very frequently.,3,2025-05-18 10:41:50,Chase,Google Play Store,NEGATIVE,0.9996758699417114
Nice banking system,5,2025-05-18 10:21:26,Chase,Google Play Store,POSITIVE,0.9998314380645752
I trust this bank,5,2025-05-18 07:41:30,Chase,Google Play Store,POSITIVE,0.9996515512466431
Great job no,5,2025-05-18 03:27:03,Chase,Google Play Store,POSITIVE,0.9941617846488953
love for you,5,2025-05-18 01:36:53,Chase,Google Play Store,POSITIVE,0.9998459815979004
nice,5,2025-05-18 01:11:10,Chase,Google Play Store,POSITIVE,0.9998552799224854
Stupid bank. For multiple reasons. I will just say that every time you want to send zelle transfer you need to get text message code and also scan id. Every time! Just move to other banks,1,2025-05-18 00:29:34,Chase,Google Play Store,NEGATIVE,0.9993062019348145
"not user friendly. gotta keep those fees rolling in. you should invest in a great AI, there are many to choose from. customers could speak in plain language and be replied to same way. ""I started a transfer from my checking account to Robinhood service app from within their app. They say ""go to Chase and approve the transfer."" except it's nowhere to be found, your app AI ""can't quite get what you say."" An hour or more later, with the help of the FANTASTIC Google AI, I have checked EVERYTHING. NI",1,2025-05-17 22:17:00,Chase,Google Play Store,NEGATIVE,0.9978489875793457
very easy to bank with,5,2025-05-17 17:58:26,Chase,Google Play Store,POSITIVE,0.9989351630210876
When will you have a version compatible with the Pixel tablet? I've been waiting for almost 2 years!,2,2025-05-17 14:38:08,Chase,Google Play Store,NEGATIVE,0.9991543292999268
easy to use thanks 😊,4,2025-05-17 14:31:10,Chase,Google Play Store,POSITIVE,0.9975106716156006
dont change,1,2025-05-17 11:35:00,Chase,Google Play Store,NEGATIVE,0.9868310689926147
they keep asking me to change my password.,1,2025-05-17 10:36:58,Chase,Google Play Store,NEGATIVE,0.9979140162467957
Still no dark theme support. It's only been a few years...,1,2025-05-17 08:58:32,Chase,Google Play Store,NEGATIVE,0.9882662892341614
convenient and easy to use,5,2025-05-17 08:54:23,Chase,Google Play Store,POSITIVE,0.9996602535247803
very easy an secure,5,2025-05-17 08:30:20,Chase,Google Play Store,POSITIVE,0.9988935589790344
+ Great bank to deal with..easy app to navigate..being a veteran- they give free checking with no stipulations..,5,2025-05-17 05:08:35,Chase,Google Play Store,NEGATIVE,0.7788991332054138
great,5,2025-05-16 17:58:18,Chase,Google Play Store,POSITIVE,0.9998630285263062
good bank. Awesome Assistant Manager at my Wells Fargo.,4,2025-06-05 11:48:02,Wells Fargo,Google Play Store,POSITIVE,0.9998611211776733
wow... first try! So I'm not completely useless in the internet age. Kool,5,2025-06-05 11:43:47,Wells Fargo,Google Play Store,POSITIVE,0.9911414384841919
"Seems too good to be true, love it!",5,2025-06-05 11:29:16,Wells Fargo,Google Play Store,POSITIVE,0.999874472618103
"I have banked with Wells Fargo for over 20 years and have always found them to be beyond helpful with any problems that have arisen. Their employees are pleasant, cordial, and extremely helpful when I've used the bank offices.",5,2025-06-05 11:08:22,Wells Fargo,Google Play Store,POSITIVE,0.9986509680747986
great service,5,2025-06-05 10:03:55,Wells Fargo,Google Play Store,POSITIVE,0.9998434782028198
know understanding,1,2025-06-05 09:24:27,Wells Fargo,Google Play Store,POSITIVE,0.9995819926261902
this institution is very dishonest. they will close your account without notice and when you do contact them it's all correspondence through security email and they just simply say they have the right to close your account without any reason. be very skeptical of this company. they are also not accredited by the BBB.,1,2025-06-05 08:50:33,Wells Fargo,Google Play Store,NEGATIVE,0.9996799230575562
Works pretty gd n easy! luv it!,5,2025-06-05 07:43:30,Wells Fargo,Google Play Store,POSITIVE,0.9983555674552917
very good,5,2025-06-05 07:24:54,Wells Fargo,Google Play Store,POSITIVE,0.9998520612716675
Wells Fargo has been my bank for many years 👍,4,2025-06-05 07:20:48,Wells Fargo,Google Play Store,POSITIVE,0.814920961856842
easy and reliable,5,2025-06-05 06:38:08,Wells Fargo,Google Play Store,POSITIVE,0.9998584985733032
muy bueno,5,2025-06-05 05:59:46,Wells Fargo,Google Play Store,NEGATIVE,0.8624677658081055
great app,5,2025-06-05 05:26:08,Wells Fargo,Google Play Store,POSITIVE,0.999821126461029
the convenienceb is immeasurable!!,5,2025-06-04 23:09:04,Wells Fargo,Google Play Store,POSITIVE,0.9990918636322021
"I absolutely love that my bank (Wells Fargo) uses Zelle so I can send money to anyone, anytime, 24° a day, seven days a week! Thanks, Wells Fargo. 😊",5,2025-06-04 19:47:10,Wells Fargo,Google Play Store,POSITIVE,0.9998024106025696
"Their app makes things really easy, with Zelle, transferring, and mobile deposits.",5,2025-06-04 18:57:03,Wells Fargo,Google Play Store,POSITIVE,0.9975497126579285
easy peasy.,5,2025-06-04 18:06:48,Wells Fargo,Google Play Store,NEGATIVE,0.9475109577178955
easy to use. different options available over web version.,5,2025-06-04 16:17:04,Wells Fargo,Google Play Store,POSITIVE,0.977299153804779
very easy and quick,5,2025-06-04 15:50:37,Wells Fargo,Google Play Store,POSITIVE,0.9995861649513245
BEST in the WEST,5,2025-06-04 15:46:41,Wells Fargo,Google Play Store,POSITIVE,0.999795138835907
I've been costumer since 2017 so far so good 👍,5,2025-06-04 15:37:33,Wells Fargo,Google Play Store,POSITIVE,0.9997739195823669
""""" Wells Fargo Bank """" is trash momentariles 'til """" Wells Fargo Bank """" provides free """" Wells Fargo Bank """" applications, navigations orientations ! """" Manice Guillaume Junior "" 8. 7. 1. 3. 1. 4. 1. """"",2,2025-06-04 14:51:42,Wells Fargo,Google Play Store,NEGATIVE,0.9978097081184387
"I constantly have to change my password, you tell me you don't recognize me",3,2025-06-04 14:04:07,Wells Fargo,Google Play Store,NEGATIVE,0.9996246099472046
it works,5,2025-06-04 13:26:38,Wells Fargo,Google Play Store,POSITIVE,0.9998537302017212
is my back 🔙,5,2025-06-04 13:21:53,Wells Fargo,Google Play Store,NEGATIVE,0.8044100403785706
people are trying to use the app to send money through zelle but it is coasting money to do it it's coasting alot of money,1,2025-06-04 12:45:29,Wells Fargo,Google Play Store,NEGATIVE,0.9990109205245972
love my wells fargo,5,2025-06-04 11:55:42,Wells Fargo,Google Play Store,POSITIVE,0.999862790107727
accoumt,1,2025-06-04 11:49:59,Wells Fargo,Google Play Store,NEGATIVE,0.884699821472168
The app is difficult to load. I would not recommend it to others,1,2025-06-04 11:18:49,Wells Fargo,Google Play Store,NEGATIVE,0.9989047050476074
good,5,2025-06-04 11:08:37,Wells Fargo,Google Play Store,POSITIVE,0.9998161196708679
good that they told us,5,2025-06-04 10:42:01,Wells Fargo,Google Play Store,POSITIVE,0.999833345413208
Easy and fast,5,2025-06-04 09:59:16,Wells Fargo,Google Play Store,POSITIVE,0.9995583891868591
great app to have,5,2025-06-04 09:23:01,Wells Fargo,Google Play Store,POSITIVE,0.9997767806053162
Zelle is excellent and so is the team at WF !!,5,2025-06-04 08:40:47,Wells Fargo,Google Play Store,POSITIVE,0.999879002571106
Too sensitive to light,4,2025-06-04 08:21:50,Wells Fargo,Google Play Store,NEGATIVE,0.9695032238960266
really good,5,2025-06-04 07:05:27,Wells Fargo,Google Play Store,POSITIVE,0.9998512268066406
so far so 👍,5,2025-06-04 06:33:00,Wells Fargo,Google Play Store,POSITIVE,0.6910821199417114
hacked,1,2025-06-03 21:57:55,Wells Fargo,Google Play Store,NEGATIVE,0.9994045495986938
Un poco fea la app,4,2025-06-03 19:28:12,Wells Fargo,Google Play Store,NEGATIVE,0.9768218398094177
THIS WHAT I LOVE ABOUT MY ACCOUNT THEY SO A ISSUE WITH ME MAKING LOTS OF TRANSACTIONS OR IT MIGHT OF BEEN A HACKER BUT ETHER OR MY WELLS FARGO IS EXTRAORDINARY CUSTOMER SERVICE NOTIFIED ME ABOUT CLOSING MY ACCOUNT AND ALL THEY WANT IS ME TO GO TO THE BRANCH TO IDENTIFY WHO I WAS BECAUSE IT COULD OF BEEN A FRAUDSTER I DEFINITELY CANT SAY THAT CHIME I WAS MAKING MY TRANSITIONS WITH CHIME PAYING WHAT I HAD TO PAY MY BILLS PEOPLE I OWED OUT TO OUT OF THE BLUE THEY STRAIGHT OUT CLOSE MY ACCOUNT,5,2025-06-03 18:25:43,Wells Fargo,Google Play Store,NEGATIVE,0.9949894547462463
WF has always been easy to work with and logical when it comes to finances.,5,2025-06-03 17:12:57,Wells Fargo,Google Play Store,POSITIVE,0.9986573457717896
I can't easily locate the account. it should be easy,3,2025-06-03 16:20:20,Wells Fargo,Google Play Store,NEGATIVE,0.9985042810440063
"wells fargo is a horrible bank. There are not many other options, though.",1,2025-06-03 16:17:01,Wells Fargo,Google Play Store,NEGATIVE,0.9993529915809631
Ive had my accounts here since 2013 AN I Never had ANY NEGATIVE ACTIONS WITH MY BANKING HERE,5,2025-06-03 15:42:27,Wells Fargo,Google Play Store,POSITIVE,0.9948403239250183
I just love Wells Fargo,5,2025-06-03 15:34:52,Wells Fargo,Google Play Store,POSITIVE,0.9998656511306763
nice,5,2025-06-03 15:02:48,Wells Fargo,Google Play Store,POSITIVE,0.9998552799224854
it was easy,5,2025-06-03 14:19:04,Wells Fargo,Google Play Store,POSITIVE,0.9950767159461975
Ok a y done,5,2025-06-03 14:09:03,Wells Fargo,Google Play Store,POSITIVE,0.9992077946662903
hard to use and not user friendly,1,2025-06-03 13:52:54,Wells Fargo,Google Play Store,NEGATIVE,0.9993295669555664
Extremely Unethical Company! I've been with them for 16 years and I haven't loved any of it.,1,2025-06-03 13:35:37,Wells Fargo,Google Play Store,NEGATIVE,0.9983200430870056
Nikki was fabulous,5,2025-06-03 13:09:57,Wells Fargo,Google Play Store,POSITIVE,0.9998726844787598
great,5,2025-06-03 12:30:55,Wells Fargo,Google Play Store,POSITIVE,0.9998630285263062
quick and easy check deposit,5,2025-06-03 12:06:02,Wells Fargo,Google Play Store,POSITIVE,0.944710910320282
love this app it's super convenient.,5,2025-06-03 11:42:42,Wells Fargo,Google Play Store,POSITIVE,0.9995744824409485
perfect app,5,2025-06-03 10:10:14,Wells Fargo,Google Play Store,POSITIVE,0.9998340606689453
mobile banking not working,1,2025-06-03 07:33:28,Wells Fargo,Google Play Store,NEGATIVE,0.9996664524078369
"This bank has been a blessing with. balance transfers at awesome rates, God send",5,2025-06-03 07:14:03,Wells Fargo,Google Play Store,POSITIVE,0.9995362758636475
good services,5,2025-06-03 07:09:09,Wells Fargo,Google Play Store,POSITIVE,0.9998517036437988
love it...,5,2025-06-03 06:40:08,Wells Fargo,Google Play Store,POSITIVE,0.9998748302459717
real good service and helpful and appreciated,5,2025-06-03 06:32:41,Wells Fargo,Google Play Store,POSITIVE,0.9998708963394165
"I have been using this app for a long time and seem to have a problem today. I am having a hard time logging in with the app. I'm able to do it directly on the website. But not the app. What could be wrong? It keeps asking me for my phone number, which I give it, and I sit and wait for a code never sent. I tried several times, and I still go through the same problem.",2,2025-06-03 06:17:46,Wells Fargo,Google Play Store,NEGATIVE,0.9989169836044312
excellent,5,2025-06-03 06:16:50,Wells Fargo,Google Play Store,POSITIVE,0.9998434782028198
"I don't like Bank's apps, on my phone. hope it's safe. But this is okay this time. Have my on wifi now.",5,2025-06-03 05:16:29,Wells Fargo,Google Play Store,POSITIVE,0.9957973957061768
your the Best Fargo! keep up the great work....,5,2025-06-03 04:39:09,Wells Fargo,Google Play Store,POSITIVE,0.9998598098754883
I love Wells Fargo,5,2025-06-03 04:18:54,Wells Fargo,Google Play Store,POSITIVE,0.9998478889465332
quick and ready to enroll and use,5,2025-06-02 20:30:16,Wells Fargo,Google Play Store,POSITIVE,0.9985892176628113
good 👍,5,2025-06-02 19:38:16,Wells Fargo,Google Play Store,POSITIVE,0.9998576641082764
The limit is to low,3,2025-06-02 17:59:17,Wells Fargo,Google Play Store,NEGATIVE,0.9907891154289246
easy peasy to make a mobile phone deposit.,4,2025-06-02 17:11:15,Wells Fargo,Google Play Store,NEGATIVE,0.9957412481307983
"So far, so good.",4,2025-06-02 16:47:01,Wells Fargo,Google Play Store,POSITIVE,0.9998441934585571
Excelente,5,2025-06-02 14:36:06,Wells Fargo,Google Play Store,POSITIVE,0.9997521042823792
"auto capture on checks iffy, just use manual",5,2025-06-02 13:10:43,Wells Fargo,Google Play Store,NEGATIVE,0.9943033456802368
user friendly,5,2025-06-02 12:56:06,Wells Fargo,Google Play Store,POSITIVE,0.9775891900062561
Mobile deposit quick and easy.,5,2025-06-02 12:34:48,Wells Fargo,Google Play Store,NEGATIVE,0.6911442279815674
can't even sign up,1,2025-06-02 12:09:17,Wells Fargo,Google Play Store,NEGATIVE,0.9997255206108093
so easy,5,2025-06-02 12:01:08,Wells Fargo,Google Play Store,POSITIVE,0.995724081993103
works great,5,2025-06-02 11:23:02,Wells Fargo,Google Play Store,POSITIVE,0.9998718500137329
Wells Fargo has been the best bank ever!,5,2025-06-02 10:37:30,Wells Fargo,Google Play Store,POSITIVE,0.9998542070388794
positive great app,5,2025-06-02 08:50:15,Wells Fargo,Google Play Store,POSITIVE,0.9998675584793091
trustworthy and very easy to use!!,1,2025-06-02 06:54:43,Wells Fargo,Google Play Store,POSITIVE,0.9997846484184265
Wells Fargo has always been a great service,5,2025-06-02 06:26:24,Wells Fargo,Google Play Store,POSITIVE,0.9997751116752625
it's a solid app,4,2025-06-02 03:00:13,Wells Fargo,Google Play Store,POSITIVE,0.9998726844787598
new to Wells Fargo. I'm really liking this bank. Customer service by phone has been very helpful and the ladies in the bank are super nice. It's been an enjoyable experience so far.,5,2025-06-02 00:17:28,Wells Fargo,Google Play Store,POSITIVE,0.9998441934585571
Very good,5,2025-06-01 23:38:04,Wells Fargo,Google Play Store,POSITIVE,0.9998520612716675
"I love using the app ,mostly for mobile deposit it's very easy and convenient...",5,2025-06-01 21:27:49,Wells Fargo,Google Play Store,POSITIVE,0.9980022311210632
"Can't access my account if I don't have my phone. This blows. There is no other option? Correction: I was trying to access it from my tablet. When trying to recover my account info, the only options were to get a text or a phone call. The reason I was using my tablet was because I didn't have my phone on me.",1,2025-06-01 20:16:45,Wells Fargo,Google Play Store,NEGATIVE,0.999536395072937
awesome,5,2025-06-01 19:35:46,Wells Fargo,Google Play Store,POSITIVE,0.9998682737350464
easy!,5,2025-06-01 17:04:46,Wells Fargo,Google Play Store,POSITIVE,0.9952214360237122
the format is a bit diffrent than a few years ago.,4,2025-06-01 14:42:25,Wells Fargo,Google Play Store,NEGATIVE,0.9991784691810608
"I'm very grateful for all the help I'm getting from Wells Fargo staff, which is very professional.",5,2025-06-01 13:40:20,Wells Fargo,Google Play Store,POSITIVE,0.9996790885925293
very good,5,2025-06-01 12:33:41,Wells Fargo,Google Play Store,POSITIVE,0.9998520612716675
easy transactions,5,2025-06-01 10:29:52,Wells Fargo,Google Play Store,POSITIVE,0.9874075651168823
My first mobile deposit.,5,2025-06-01 09:47:15,Wells Fargo,Google Play Store,POSITIVE,0.5407616496086121
I like wells Fargo I've never had any problems with the bank or staff good people,4,2025-06-01 08:43:11,Wells Fargo,Google Play Store,POSITIVE,0.9989956021308899
"Great People, Great Service.",5,2025-06-01 07:26:19,Wells Fargo,Google Play Store,POSITIVE,0.9998681545257568
"they advertise this card as great for transfers but you can not transfer from the app.. the section that even says ""pay and transfer"" only has the option to pay. set my mother up for the same card thinking my phone was messed up but nope.. Definitely the App 1000% regret ever getting it ps ive had it for a few months they still have not fixed the issue with most recent update. card will continue to sit with no money on it until they deactivate it!",1,2025-06-01 04:42:03,Wells Fargo,Google Play Store,NEGATIVE,0.999176561832428
I love banking online and Wells Fargo makes it easy,5,2025-06-01 04:08:29,Wells Fargo,Google Play Store,POSITIVE,0.9995618462562561
easy access,5,2025-05-31 22:52:40,Wells Fargo,Google Play Store,POSITIVE,0.9995589852333069
I am no longer able to access my wells Fargo becouse my phone doesn't configure to the apps new design. now I cant do anything with wells Fargo from my phone. Absolutely terrible. I've been with them for over 20 years. might be time to upgrade my bank?🤔,1,2025-05-31 22:21:26,Wells Fargo,Google Play Store,NEGATIVE,0.9995388984680176
Debra Potts love zelle.,5,2025-05-31 17:27:37,Wells Fargo,Google Play Store,POSITIVE,0.9995891451835632
First time I deposited a paper check the easy way from home. Just love that.,5,2025-05-31 17:12:02,Wells Fargo,Google Play Store,POSITIVE,0.9998551607131958
love it very easy to operate,5,2025-05-31 15:00:44,Wells Fargo,Google Play Store,POSITIVE,0.9998797178268433
Great!,5,2025-05-31 14:14:44,Wells Fargo,Google Play Store,POSITIVE,0.9998692274093628
I love this app it does everything I needed to do even though I have had problems in the past with taking a picture of a Wells Fargo check and it not accepting it. that was enough to almost make me take off several Stars but it does do everything else I need so we're good,5,2025-05-31 13:30:46,Wells Fargo,Google Play Store,POSITIVE,0.9998016953468323
"Was a bit frustrated that there was a security block on Zelle when opening a new account. Completely understandable, and I am grateful, but I was not informed. I'm very happy with the services now. The miscommunication was an issue at first, but I feel it will have a five-star review soon.",3,2025-05-31 12:32:41,Wells Fargo,Google Play Store,POSITIVE,0.9989020824432373
Great app,5,2025-05-31 11:53:51,Wells Fargo,Google Play Store,POSITIVE,0.999821126461029
The app works well. No problem so far. 👍,5,2025-05-31 11:35:39,Wells Fargo,Google Play Store,POSITIVE,0.9991475343704224
good App,5,2025-05-31 11:30:27,Wells Fargo,Google Play Store,POSITIVE,0.9998493194580078
reliable,5,2025-05-31 10:53:25,Wells Fargo,Google Play Store,POSITIVE,0.999845027923584
This Bank has always been excellent to me!,5,2025-05-31 10:03:17,Wells Fargo,Google Play Store,POSITIVE,0.9998531341552734
Wells Fargo and Wells Fargo mobile have always made banking easy for me.,5,2025-05-31 09:58:36,Wells Fargo,Google Play Store,POSITIVE,0.9981618523597717
Thank you,5,2025-05-31 09:44:26,Wells Fargo,Google Play Store,POSITIVE,0.9998352527618408
great way to spend time spending money!,5,2025-05-31 09:24:38,Wells Fargo,Google Play Store,POSITIVE,0.9992498755455017
always easy to us,5,2025-05-31 09:08:44,Wells Fargo,Google Play Store,POSITIVE,0.9993333220481873
Very user friendly,5,2025-05-31 08:50:47,Wells Fargo,Google Play Store,POSITIVE,0.9951106905937195
"I do NOT want notifications to pop up on my phone about statements being ready, and I can't find a way to turn them off! I get emails for those! I only want notifications of payments or negative balances like I used to get!",3,2025-05-31 08:45:49,Wells Fargo,Google Play Store,NEGATIVE,0.9994538426399231
excellent services.,5,2025-05-31 08:39:14,Wells Fargo,Google Play Store,POSITIVE,0.99986732006073
Great Bank for me.,5,2025-05-31 08:14:26,Wells Fargo,Google Play Store,POSITIVE,0.9991857409477234
Won't download app Won't download app.,1,2025-05-31 07:02:00,Wells Fargo,Google Play Store,NEGATIVE,0.9867926836013794
great not perfect,4,2025-05-31 07:02:00,Wells Fargo,Google Play Store,NEGATIVE,0.9986608028411865
muy Bien servicio Al cliente siempre esta ahi para ayudarte,5,2025-05-31 07:01:03,Wells Fargo,Google Play Store,NEGATIVE,0.886939287185669
so easy,5,2025-05-31 06:43:12,Wells Fargo,Google Play Store,POSITIVE,0.995724081993103
My zelle transfer was quite prompt.,5,2025-05-30 22:51:03,Wells Fargo,Google Play Store,POSITIVE,0.9937657117843628
